{
  "schema_version": "my-data-hub-real-kaggle-matrix-plan.v1",
  "matrix_id": "aaaaaaaa-aaaa-4aaa-8aaa-aaaaaaaaaaaa",
  "commit_sha": "aaaaaaaaaaaaaaaaaaaaaaaaaaaaaaaaaaaaaaaa",
  "created_at": "2026-08-11T00:00:00+00:00",
  "minimum_real_runs": 15,
  "scenarios": [
    {
      "ordinal": 1,
      "name": "baseline-private-runtime",
      "category": "baseline",
      "variant": "exact-private-generated-notebook",
      "fault_probe": null,
      "checkpoint_bound": false,
      "task_id": "be5d06e0-c50c-5a31-b3bf-79adacfdae7f",
      "task_run_id": "c3c4d9f1-6137-5ce7-869e-155f3f358d20",
      "work_item_id": "435f69e4-fd64-5c4f-a051-4130800dde61",
      "subject_id": "8123bd5d-e244-5abf-94e4-e5d678e6babc",
      "checkpoint_id": null,
      "checkpoint_manifest_sha256": null
    },
    {
      "ordinal": 2,
      "name": "exact-source-readback",
      "category": "identity",
      "variant": "exact-source-version-sha",
      "fault_probe": null,
      "checkpoint_bound": false,
      "task_id": "8df99bd8-65aa-5655-83ab-13618b5dc3db",
      "task_run_id": "4f5de582-ca8b-5fad-90eb-7f1422417c4a",
      "work_item_id": "5915a7e5-fd64-57af-8239-5002a305af5f",
      "subject_id": "13f3cc16-307f-5015-9c34-b9840999bc59",
      "checkpoint_id": null,
      "checkpoint_manifest_sha256": null
    },
    {
      "ordinal": 3,
      "name": "exact-output-readback",
      "category": "identity",
      "variant": "exact-numeric-run-output",
      "fault_probe": null,
      "checkpoint_bound": false,
      "task_id": "94d0e514-6ef6-51e3-a7df-b52b1589c600",
      "task_run_id": "59eef373-f910-5c15-9719-9552518daa29",
      "work_item_id": "69b0be8a-740a-52c2-b842-e04433c1b182",
      "subject_id": "20db1068-baf9-5c71-abee-ee1aca662077",
      "checkpoint_id": null,
      "checkpoint_manifest_sha256": null
    },
    {
      "ordinal": 4,
      "name": "status-retry-observation",
      "category": "retry",
      "variant": "repeat-status-read",
      "fault_probe": "repeat_status",
      "checkpoint_bound": false,
      "task_id": "2b193452-5bbb-501c-9f5b-23d5dcda06ae",
      "task_run_id": "5f133310-dda2-5b48-9a24-e5b9159f8a15",
      "work_item_id": "cd8ae723-40c7-596b-8f03-3c8f7db66db6",
      "subject_id": "210b3e21-fc1c-539c-b578-368e294fcc29",
      "checkpoint_id": null,
      "checkpoint_manifest_sha256": null
    },
    {
      "ordinal": 5,
      "name": "output-retry-observation",
      "category": "retry",
      "variant": "repeat-output-read",
      "fault_probe": "repeat_output",
      "checkpoint_bound": false,
      "task_id": "9ff92665-8964-560e-8acc-5eb0445e9f99",
      "task_run_id": "7c1675d2-169f-59a7-a927-d6226acf1c52",
      "work_item_id": "40a0a8bc-1a75-5918-b406-0d87f0d9520d",
      "subject_id": "103fa396-cbf1-55c2-99d6-34d2df9d5734",
      "checkpoint_id": null,
      "checkpoint_manifest_sha256": null
    },
    {
      "ordinal": 6,
      "name": "resume-exact-run",
      "category": "resume",
      "variant": "reconcile-after-push",
      "fault_probe": "reconcile",
      "checkpoint_bound": false,
      "task_id": "e523de77-f1ca-5c31-a373-1e4ee3a5dc17",
      "task_run_id": "27b95b57-0de1-5193-b90b-d96f116430dc",
      "work_item_id": "8d0eaba5-79be-5622-bcde-5801c221945f",
      "subject_id": "a0e8ac7a-5bb3-5e53-9888-043a4a5a4032",
      "checkpoint_id": null,
      "checkpoint_manifest_sha256": null
    },
    {
      "ordinal": 7,
      "name": "idempotent-reconcile",
      "category": "idempotency",
      "variant": "repeat-reconciliation",
      "fault_probe": "reconcile_twice",
      "checkpoint_bound": false,
      "task_id": "e1597e89-6269-59ca-a358-e7fccaac4d76",
      "task_run_id": "c29eaa03-7d76-5b25-be0e-018a160794f8",
      "work_item_id": "b2c51340-9bf7-5f15-9489-24bc7543ec28",
      "subject_id": "d321ad78-5dc9-5359-8c92-b020a2022c41",
      "checkpoint_id": null,
      "checkpoint_manifest_sha256": null
    },
    {
      "ordinal": 8,
      "name": "claim-cleanup-replay",
      "category": "idempotency",
      "variant": "repeat-claim-cleanup",
      "fault_probe": "cleanup_replay",
      "checkpoint_bound": false,
      "task_id": "893db5c4-a8d1-581c-bbf7-6d8752b39d35",
      "task_run_id": "c5219d1c-f7d8-5911-8f4b-cb26baabcf4c",
      "work_item_id": "9ec7ccac-e8ef-57b3-a7cd-0b78487f7625",
      "subject_id": "aeb3667e-5ff5-5402-8455-dbd0f0a66bca",
      "checkpoint_id": null,
      "checkpoint_manifest_sha256": null
    },
    {
      "ordinal": 9,
      "name": "stale-source-fence",
      "category": "fault",
      "variant": "stale-source-sha-denial",
      "fault_probe": "stale_source",
      "checkpoint_bound": false,
      "task_id": "2cd5ad27-e23a-5df7-8d3c-21dccdb99e07",
      "task_run_id": "0401df06-ad87-5196-b3d1-d9a119f6c680",
      "work_item_id": "58a22a96-f8c7-5e89-a124-9c10b0ea0790",
      "subject_id": "3145a0b9-3138-5eda-b62f-baa013b4d7d8",
      "checkpoint_id": null,
      "checkpoint_manifest_sha256": null
    },
    {
      "ordinal": 10,
      "name": "stale-run-fence",
      "category": "fault",
      "variant": "stale-numeric-version-denial",
      "fault_probe": "stale_run",
      "checkpoint_bound": false,
      "task_id": "5f5e8af4-122b-5dc4-a306-3426f3949b01",
      "task_run_id": "567dd779-52b2-5bbb-9828-c207b44274ff",
      "work_item_id": "e0d80f26-389c-5838-9a12-6cec17c4b920",
      "subject_id": "26fe2ae1-28c1-548e-811c-381365a2218b",
      "checkpoint_id": null,
      "checkpoint_manifest_sha256": null
    },
    {
      "ordinal": 11,
      "name": "checkpoint-current-binding",
      "category": "checkpoint",
      "variant": "current-checkpoint-manifest",
      "fault_probe": null,
      "checkpoint_bound": true,
      "task_id": "e6514f8a-e767-5cd6-b7e7-2b4e0374a6ff",
      "task_run_id": "8f5e01f8-106f-5aa2-b18f-2bf2868e4692",
      "work_item_id": "0346a078-461b-5f1b-bc61-a52f4cedcbdb",
      "subject_id": "ef4ca41d-26a8-50ae-b1bb-ffd03449b7de",
      "checkpoint_id": "15c4e347-a2d6-5cbd-999e-3a93943e94e0",
      "checkpoint_manifest_sha256": "333aa164e3533d551f2ef8e4908818fd57f53ea95c0c543b5eb8b05463f1d6f6"
    },
    {
      "ordinal": 12,
      "name": "checkpoint-resume-binding",
      "category": "checkpoint",
      "variant": "checkpoint-resume-idempotency",
      "fault_probe": "reconcile",
      "checkpoint_bound": true,
      "task_id": "b76f3483-f24b-5c23-b58e-64483809f6a9",
      "task_run_id": "6a293f96-9dd1-5c45-9a7b-0a2871e5fcae",
      "work_item_id": "378b30ba-eb05-570d-9266-795f2582ea32",
      "subject_id": "11effec2-6824-5aac-80c5-aa84575f0daf",
      "checkpoint_id": "d08cbc73-2044-57d2-b8a3-42987430bc0f",
      "checkpoint_manifest_sha256": "206cd5fc0232ec3929fc4fe0c6c1c38d963fa2d43dce92d9de3ff54f3b31d9b9"
    },
    {
      "ordinal": 13,
      "name": "runtime-accounting-binding",
      "category": "contract",
      "variant": "typed-item-accounting",
      "fault_probe": null,
      "checkpoint_bound": false,
      "task_id": "b4060e0e-4529-5df8-9412-93dadaf36a5a",
      "task_run_id": "7950ad37-6363-5cd1-b2c9-80cc722a7738",
      "work_item_id": "b80d8edb-1920-5f65-931f-e821d59f16b1",
      "subject_id": "6dacf46d-4a63-576f-8f43-ecc778beac09",
      "checkpoint_id": null,
      "checkpoint_manifest_sha256": null
    },
    {
      "ordinal": 14,
      "name": "short-soak-a",
      "category": "soak",
      "variant": "sequential-soak-1",
      "fault_probe": null,
      "checkpoint_bound": false,
      "task_id": "ea9f8b8b-b79c-58d0-a034-78647c58ce5a",
      "task_run_id": "7d295244-75a1-50be-85ec-a127fda7b14d",
      "work_item_id": "eeefe280-05b2-5c78-aa4f-62b877edce8f",
      "subject_id": "c876fc8e-4435-5d2c-b848-ecd36d15fac8",
      "checkpoint_id": null,
      "checkpoint_manifest_sha256": null
    },
    {
      "ordinal": 15,
      "name": "short-soak-b",
      "category": "soak",
      "variant": "sequential-soak-2",
      "fault_probe": null,
      "checkpoint_bound": false,
      "task_id": "fb4095d8-f79e-5206-9375-68bbcc9d75ba",
      "task_run_id": "65a238c4-8441-54b6-842d-8956ae40da85",
      "work_item_id": "dd9aa56c-b70b-5473-a97b-abe5e8d7e3bd",
      "subject_id": "0da4726a-bfb3-5aa6-8225-7bc4b76a56c9",
      "checkpoint_id": null,
      "checkpoint_manifest_sha256": null
    },
    {
      "ordinal": 16,
      "name": "short-soak-c",
      "category": "soak",
      "variant": "sequential-soak-3",
      "fault_probe": null,
      "checkpoint_bound": false,
      "task_id": "9ec559bf-e66f-5131-9c9a-f0709932f16f",
      "task_run_id": "f403e704-79ac-5621-80bd-64dccc99e68d",
      "work_item_id": "0ce9e55a-447a-5537-9430-dd1afa7cf2f6",
      "subject_id": "75ad3261-aa3c-5f00-b7e4-00675bceac7f",
      "checkpoint_id": null,
      "checkpoint_manifest_sha256": null
    }
  ]
}
